### ISSUE TITLE
LDAPS failing (against AD)

### ISSUE THREAD

**Issue by greenaussie** [multiOTP/multiotp#18]
Hi 

LDAPS is failing with multiOTP. Credentials are correct, as simply switching the ``ldap_ssl=0|1`` value will make it work correctly using unsecured LDAP. LDAPS works correctly using ``ldapsearch -x -H ldaps://...``, thus ``/etc/openldap/ldap.conf`` is correctly configured to find my CA certificate bundle). 

When I watch the network activity, SSL negotiation does not appear to start (see comparison below).

How can I troubleshoot this problem, the debug information has not assisted.

Thanks!

```
# php multiotp.php -debug -display-log -ldap-users-sync
[root@ip-10-118-240-153 multiotp]# php multiotp.php -debug -display-log -ldap-users-sync

LOG 2017-06-08 04:07:23 debug Debug Debug: *parameter(s) received: -debug -display-log -ldap-users-sync

LOG 2017-06-08 04:07:23 debug LDAP Debug: *AD/LDAP synchronization started at 04:07:23 / Memory used: 12.6MB / Peak: 12.7MB

LOG 2017-06-08 04:07:23 info LDAP Info: AD/LDAP synchronization started

LOG 2017-06-08 04:07:23 debug System Debug: *LDAP cache folder value: /tmp/.ldap_cache/

LOG 2017-06-08 04:07:23 warning LDAP Error: FATAL: AD bind failed. Either the LDAPS connection failed or the login credentials are incorrect (Can't contact LDAP server).
99 *ERROR: Authentication failed (and other possible unknown errors)

LOG 2017-06-08 04:07:23 debug Debug Debug: *Attributes sent to the RADIUS server: Reply-Message := "ERROR: Authentication failed (and other possible unknown errors)"
Reply-Message := "ERROR: Authentication failed (and other possible unknown errors)"
```

```
# tshark -i any -f "port 636 or port 389"
0.000000000 10.118.241.59 -> 10.118.241.61 TCP 76 45474 > ldaps [SYN] Seq=0 Win=26883 Len=0 MSS=8961 SACK_PERM=1 TSval=686662323 TSecr=0 WS=64
0.000464389 10.118.241.61 -> 10.118.241.59 TCP 76 ldaps > 45474 [SYN, ACK] Seq=0 Ack=1 Win=8192 Len=0 MSS=8961 WS=256 SACK_PERM=1 TSval=1202003127 TSecr=686662323
0.000476033 10.118.241.59 -> 10.118.241.61 TCP 68 45474 > ldaps [ACK] Seq=1 Ack=1 Win=26944 Len=0 TSval=686662323 TSecr=1202003127
0.019034362 10.118.241.59 -> 10.118.241.61 TCP 68 45474 > ldaps [FIN, ACK] Seq=1 Ack=1 Win=26944 Len=0 TSval=686662328 TSecr=1202003127
0.019559802 10.118.241.61 -> 10.118.241.59 TCP 68 ldaps > 45474 [ACK] Seq=1 Ack=2 Win=71424 Len=0 TSval=1202003146 TSecr=686662328
0.019612819 10.118.241.61 -> 10.118.241.59 TCP 56 ldaps > 45474 [RST, ACK] Seq=1 Ack=2 Win=0 Len=0
```
```
ldapsearch -x -H ldaps://my.dc.address -b 'DC=my,DC=dc,DC=address' -D 'CN=LDAP Search Service Account,CN=Users,DC=my,DC=dc,DC=address' -W '(sAMAccountName=mytestsuser)'
# extended LDIF
#
# LDAPv3
# base <DC=aderica01,DC=erica,DC=med,dc=unsw,dc=edu,dc=au> with scope subtree
# filter: (sAMAccountName=ldapsearch_svc)
# requesting: ALL
#
.
.
.
# search result
search: 2
result: 0 Success

# numResponses: 5
# numEntries: 1
# numReferences: 3
```
```
# tshark -i any -f "port 636 or port 389"
96.555167772 10.118.241.59 -> 10.118.241.61 TCP 76 45476 > ldaps [SYN] Seq=0 Win=26883 Len=0 MSS=8961 SACK_PERM=1 TSval=686686462 TSecr=0 WS=64
96.555754406 10.118.241.61 -> 10.118.241.59 TCP 76 ldaps > 45476 [SYN, ACK] Seq=0 Ack=1 Win=8192 Len=0 MSS=8961 WS=256 SACK_PERM=1 TSval=1202099679 TSecr=686686462
96.555767178 10.118.241.59 -> 10.118.241.61 TCP 68 45476 > ldaps [ACK] Seq=1 Ack=1 Win=26944 Len=0 TSval=686686462 TSecr=1202099679
96.573161989 10.118.241.59 -> 10.118.241.61 SSL 209 Client Hello
96.621297340 10.118.241.61 -> 10.118.241.59 TLSv1.2 3719 Server Hello, Certificate, Server Key Exchange, Certificate Request, Server Hello Done
96.621412610 10.118.241.59 -> 10.118.241.61 TCP 68 45476 > ldaps [ACK] Seq=142 Ack=3652 Win=44800 Len=0 TSval=686686478 TSecr=1202099745
96.625168331 10.118.241.59 -> 10.118.241.61 TLSv1.2 225 Certificate, Client Key Exchange, Change Cipher Spec, Encrypted Handshake Message
96.629945411 10.118.241.61 -> 10.118.241.59 TLSv1.2 143 Change Cipher Spec, Encrypted Handshake Message
96.630208543 10.118.241.59 -> 10.118.241.61 TLSv1.2 233 Application Data
96.641961328 10.118.241.61 -> 10.118.241.59 TLSv1.2 137 Application Data
96.642242428 10.118.241.59 -> 10.118.241.61 TLSv1.2 233 Application Data
96.647669227 10.118.241.61 -> 10.118.241.59 TLSv1.2 2201 Application Data
96.648519230 10.118.241.59 -> 10.118.241.61 TLSv1.2 121 Application Data
96.648567646 10.118.241.59 -> 10.118.241.61 TLSv1.2 121 Encrypted Alert
96.648589314 10.118.241.59 -> 10.118.241.61 TCP 68 45476 > ldaps [FIN, ACK] Seq=735 Ack=5929 Win=52096 Len=0 TSval=686686485 TSecr=1202099771
96.649031254 10.118.241.61 -> 10.118.241.59 TCP 68 ldaps > 45476 [ACK] Seq=5929 Ack=735 Win=572160 Len=0 TSval=1202099773 TSecr=686686485
96.649056779 10.118.241.61 -> 10.118.241.59 TCP 68 ldaps > 45476 [ACK] Seq=5929 Ack=736 Win=572160 Len=0 TSval=1202099773 TSecr=686686485
96.649117104 10.118.241.61 -> 10.118.241.59 TCP 56 ldaps > 45476 [RST, ACK] Seq=5929 Ack=736 Win=0 Len=0
```

**Comment by multiOTP** [comment]
Hello,
Just to be sure, in your multiotp.ini configuration file, do you have ldap_ssl=1 AND ldap_port=636 ?
Best regards,
Andre

**Comment by greenaussie** [comment]
Hi Andre

The problem turns out to be line 881 of multiotp.class.php, which I commented out because ``NORMAL`` is not a listed cipher string for my version of OpenSSL (OpenSSL 1.0.1t) on Amazon Linux. My replacement string is shown below:
```
// putenv('LDAPTLS_CIPHER_SUITE=NORMAL:!VERS-TLS1.2');
putenv('LDAPTLS_CIPHER_SUITE=HIGH:!TLSv1:!SSLv3:!SSLv2'); 
```
I also commented out this line because my certificate bundle is correctly found via my ``/etc/openldap/ldap.conf`` file: 
```
// putenv('LDAPTLS_REQCERT=never');   
```
For a future release, would you consider moving hard coded OpenLDAP configuration values to the multiOTP configuration file, and if they are unspecified, the OpenLDAP libraries would have default behaviour for the platform?

Thank you for sharing your work ! : )

-Richard

**Comment by multiOTP** [comment]
Hello,
Thanks for your proposals, the LDAP options will be moved in the configuration file starting with the next release.
Regards,
Andre
